{
  "failures": [],
  "profile": "quick",
  "runtime_execution": "SKIPPED",
  "schema_version": "1.0",
  "summary": {
    "access_level_conflict_accuracy": 0.0,
    "access_level_violation_count": 0,
    "access_zone_conflict_accuracy": 0.0,
    "cross_zone_leakage_count": 0,
    "distractor_false_positive_count": 0,
    "duplicate_rate_after_mmr": 0.0,
    "duplicate_rate_before_mmr": 0.0,
    "empty_context_rate": 0.0,
    "exact_phrase_hit_rate": 0.0,
    "expected_aspect_coverage": 0.0,
    "expected_block_hit_rate": 0.0,
    "expected_document_hit_rate": 0.0,
    "forbidden_block_leakage_count": 0,
    "forbidden_document_leakage_count": 0,
    "forbidden_phrase_leakage_count": 0,
    "graph_expansion_p95_ms": 0,
    "graph_expansion_rate": 0.0,
    "graph_expected_related_hit_rate": 0.0,
    "graph_helped_count": 0,
    "graph_helped_to_hurt_ratio": 0.0,
    "graph_hurt_count": 0,
    "graph_noise_rate": 0.0,
    "hard_negative_false_positive_rate": 0.0,
    "legal_similar_rule_confusion_count": 0,
    "long_document_target_block_hit_rate": 0.0,
    "mmr_dense_mode_used_count": 0,
    "mmr_expected_aspect_coverage": 0.0,
    "mmr_p95_ms": 0,
    "mmr_token_fallback_count": 0,
    "mrr": 0.0,
    "ndcg_at_10": 0.0,
    "outbox_completed_count": 0,
    "outbox_created_count": 0,
    "outbox_dead_letter_count": 0,
    "outbox_retry_count": 0,
    "outbox_staleness_p50_ms": 0,
    "outbox_staleness_p95_ms": 0,
    "qdrant_missing_points": 0,
    "qdrant_orphan_points": 0,
    "qdrant_search_p95_ms": 0,
    "qdrant_synced_points": 0,
    "questions_failed": 0,
    "questions_passed": 114,
    "questions_total": 114,
    "recall_at_1": 0.0,
    "recall_at_10": 0.0,
    "recall_at_3": 0.0,
    "recall_at_5": 0.0,
    "retrieve_context_p50_ms": 0,
    "retrieve_context_p95_ms": 0,
    "retrieve_context_p99_ms": 0,
    "total_bench_duration_ms": 0
  },
  "verdict": "PASS"
}